{
  "schema_version": "investigation-case-v3",
  "set_id": "protocol-v2-adjudication-seed-1",
  "case_id": "inv-pa06-review-resolved",
  "tags": [
    "t3",
    "activity_guided",
    "synthetic",
    "predictor_adjudication",
    "corroborate"
  ],
  "task_group": "T3",
  "workflow_context": "activity_guided",
  "answerability": "answerable_from_corpus",
  "evidence_mode": "frozen",
  "cohort": "synthetic_engineering",
  "stress_set": false,
  "inputs_ref": {
    "path": "../inputs/inv-pa06-review-resolved.json",
    "sha256": "eee093ef41d2b97b7659bc420e5f36623690a5aab71182cf18543a7bf3f27f61"
  },
  "gold_ref": {
    "path": "../gold/inv-pa06-review-resolved.json",
    "sha256": "0733f086c93f19bc1370088f92bc9f986187188e09d651585f1dec668341337e"
  },
  "provenance": {
    "kind": "synthetic_engineering_fixture"
  },
  "dependency_groups": {
    "compounds": [
      "C#Cc1cccc(Nc2ncnc3cc(OC)c(OC)cc23)c1"
    ],
    "documents": [
      "MED:93161"
    ],
    "measurements": [
      "inv-pa06-review-resolved:estimate",
      "inv-pa06-review-resolved:ic50"
    ],
    "sources": [
      "MED:93161"
    ]
  },
  "split": "dev",
  "spec_sha256": "07ef537724eb9379fb8eefceacfab80c7060ce88fcb5969d6f2a5227d9825402"
}
