{
  "schema_version": "investigation-case-v3",
  "set_id": "protocol-v2-technical-seed-1",
  "case_id": "inv-t04-margin-needs-exposure",
  "tags": [
    "t4",
    "toxicity_only",
    "synthetic"
  ],
  "task_group": "T4",
  "workflow_context": "toxicity_only",
  "answerability": "needs_user_input",
  "evidence_mode": "frozen",
  "cohort": "synthetic_engineering",
  "stress_set": false,
  "inputs_ref": {
    "path": "../inputs/inv-t04-margin-needs-exposure.json",
    "sha256": "aa389cf2eef6225b3348172d7f180b91e59a4b89af5aa7cb4951a0e42f5480af"
  },
  "gold_ref": {
    "path": "../gold/inv-t04-margin-needs-exposure.json",
    "sha256": "72ce5c72d66325f3a681b7977e4b8d093cb69f6f88502ebe636a2b7eb2734723"
  },
  "provenance": {
    "kind": "synthetic_engineering_fixture"
  },
  "dependency_groups": {
    "compounds": [
      "CC(C)NCC(O)c1ccc(NS(C)(=O)=O)cc1"
    ],
    "documents": [],
    "measurements": [],
    "sources": []
  },
  "split": "dev",
  "spec_sha256": "25c197a2d8432263d7220ec2d2f770e2a2cb91683be4f555ac0cd6e7bce1bed5"
}
