{
  "schema_version": "investigation-case-v3",
  "set_id": "protocol-v2-adjudication-seed-1",
  "case_id": "inv-pt02-herg-nonblocker-confirmed",
  "tags": [
    "t3",
    "toxicity_only",
    "synthetic",
    "predictor_adjudication",
    "corroborate"
  ],
  "task_group": "T3",
  "workflow_context": "toxicity_only",
  "answerability": "answerable_from_corpus",
  "evidence_mode": "frozen",
  "cohort": "synthetic_engineering",
  "stress_set": false,
  "inputs_ref": {
    "path": "../inputs/inv-pt02-herg-nonblocker-confirmed.json",
    "sha256": "594592d67f8c00d9c8b30d0d73fcc0df2f6f707219ad0f4a159e5ce8cd91f866"
  },
  "gold_ref": {
    "path": "../gold/inv-pt02-herg-nonblocker-confirmed.json",
    "sha256": "434cc5d77d93086688abf4d2fa47e5bf01971b1ff0e1fc5e4b4469dfd4f39352"
  },
  "provenance": {
    "kind": "synthetic_engineering_fixture"
  },
  "dependency_groups": {
    "compounds": [
      "COc1ccc(CCN(C)C)cc1"
    ],
    "documents": [
      "MED:93021"
    ],
    "measurements": [
      "inv-pt02-herg-nonblocker-confirmed:p",
      "inv-pt02-herg-nonblocker-confirmed:ic50"
    ],
    "sources": [
      "MED:93021"
    ]
  },
  "split": "dev",
  "spec_sha256": "4c8eb0bc29dc210b091ee20dc176d4972e7980aa4ea0e2a4ae5e6a59d3f8c4f3"
}
