{
  "schema_version": "investigation-case-v3",
  "set_id": "protocol-v2-technical-seed-1",
  "case_id": "inv-a04-continue-needs-exposure",
  "tags": [
    "t4",
    "activity_guided",
    "synthetic"
  ],
  "task_group": "T4",
  "workflow_context": "activity_guided",
  "answerability": "needs_user_input",
  "evidence_mode": "frozen",
  "cohort": "synthetic_engineering",
  "stress_set": false,
  "inputs_ref": {
    "path": "../inputs/inv-a04-continue-needs-exposure.json",
    "sha256": "e42f51da62871ae8fdf642d63df44869855471b362178e815be1b3eb987757a5"
  },
  "gold_ref": {
    "path": "../gold/inv-a04-continue-needs-exposure.json",
    "sha256": "a72233ab04ec727d3bee8b7c2b164f7b6f3961c3ea8be05d0a2e5eb45e0baf6c"
  },
  "provenance": {
    "kind": "synthetic_engineering_fixture"
  },
  "dependency_groups": {
    "compounds": [
      "CCOc1ccc2nc(S(N)(=O)=O)sc2c1"
    ],
    "documents": [],
    "measurements": [],
    "sources": []
  },
  "split": "dev",
  "spec_sha256": "5ad7fc55d75877f4c2b2b680035a4a0eee68a728cf11d96472df6360c5f89dbd"
}
