{
  "schema_version": "investigation-case-v3",
  "set_id": "protocol-v2-technical-seed-1",
  "case_id": "inv-a01-screening-review-explained",
  "tags": [
    "t1",
    "activity_guided",
    "synthetic"
  ],
  "task_group": "T1",
  "workflow_context": "activity_guided",
  "answerability": "answerable_from_corpus",
  "evidence_mode": "frozen",
  "cohort": "synthetic_engineering",
  "stress_set": false,
  "inputs_ref": {
    "path": "../inputs/inv-a01-screening-review-explained.json",
    "sha256": "ed37ebb07709c4d2d7521b28206978e82f4f969e2bbbe1ee7be2af02103abeaa"
  },
  "gold_ref": {
    "path": "../gold/inv-a01-screening-review-explained.json",
    "sha256": "010b4ec24ccfb5e8a29686252f09ee53deb30cfa43ba6c4af009a45a72f02d31"
  },
  "provenance": {
    "kind": "synthetic_engineering_fixture"
  },
  "dependency_groups": {
    "compounds": [
      "CCOc1ccc2nc(S(N)(=O)=O)sc2c1"
    ],
    "documents": [],
    "measurements": [
      "inv-a01-screening-review-explained:decision",
      "inv-a01-screening-review-explained:toxicity_run"
    ],
    "sources": []
  },
  "split": "dev",
  "spec_sha256": "da27e2bd3e4265f75a1c0b959f2a868e455b29c10c06bed3f7245113bf37aed7"
}
