{
  "schema_version": "investigation-case-v3",
  "set_id": "protocol-v2-adjudication-seed-1",
  "case_id": "inv-pt03-herg-missed-blocker",
  "tags": [
    "t3",
    "toxicity_only",
    "synthetic",
    "predictor_adjudication",
    "challenge"
  ],
  "task_group": "T3",
  "workflow_context": "toxicity_only",
  "answerability": "answerable_from_corpus",
  "evidence_mode": "frozen",
  "cohort": "synthetic_engineering",
  "stress_set": false,
  "inputs_ref": {
    "path": "../inputs/inv-pt03-herg-missed-blocker.json",
    "sha256": "c7c63171d46a9b5f163a8593f917c502c23046c1e4a6c53d216ed307de0d7f67"
  },
  "gold_ref": {
    "path": "../gold/inv-pt03-herg-missed-blocker.json",
    "sha256": "3873926391714ea9c97cfc1d26c5d98107aa762ea2074fde17a24e483213b8da"
  },
  "provenance": {
    "kind": "synthetic_engineering_fixture"
  },
  "dependency_groups": {
    "compounds": [
      "CCN(CC)CCOC(=O)c1ccccc1N"
    ],
    "documents": [
      "MED:93031"
    ],
    "measurements": [
      "inv-pt03-herg-missed-blocker:p",
      "inv-pt03-herg-missed-blocker:ic50"
    ],
    "sources": [
      "MED:93031"
    ]
  },
  "split": "dev",
  "spec_sha256": "63096298fd9458bacf1c857331305ade95cba6dc7dfcf3ddda27b6f660775e5e"
}
