{
  "schema_version": "investigation-case-v3",
  "set_id": "protocol-v2-adjudication-seed-1",
  "case_id": "inv-pt06-herg-abstract-decides",
  "tags": [
    "t3",
    "toxicity_only",
    "synthetic",
    "predictor_adjudication",
    "challenge"
  ],
  "task_group": "T3",
  "workflow_context": "toxicity_only",
  "answerability": "answerable_from_corpus",
  "evidence_mode": "frozen",
  "cohort": "synthetic_engineering",
  "stress_set": false,
  "inputs_ref": {
    "path": "../inputs/inv-pt06-herg-abstract-decides.json",
    "sha256": "638a2521a930e56b4f42eacbb87e75a902e29d1c353f8e36579653683dbee9f9"
  },
  "gold_ref": {
    "path": "../gold/inv-pt06-herg-abstract-decides.json",
    "sha256": "3ad62fdd6b0c170b141e7e28b4e56dc9d009fd99a7eb8e631eea0bc5dd0eb1d2"
  },
  "provenance": {
    "kind": "synthetic_engineering_fixture"
  },
  "dependency_groups": {
    "compounds": [
      "CN1CCC(CC1)Oc1ccc(F)cc1"
    ],
    "documents": [
      "MED:93061"
    ],
    "measurements": [
      "inv-pt06-herg-abstract-decides:p",
      "inv-pt06-herg-abstract-decides:ic50"
    ],
    "sources": [
      "MED:93061"
    ]
  },
  "split": "dev",
  "spec_sha256": "e25e22f6c040ad4d8c7024f624cdc9dbb1007f491a5df932e548df090694a986"
}
