{
  "schema_version": "investigation-case-v3",
  "set_id": "protocol-v2-adjudication-seed-1",
  "case_id": "inv-pa03-estimate-missed-active",
  "tags": [
    "t3",
    "activity_guided",
    "synthetic",
    "predictor_adjudication",
    "challenge"
  ],
  "task_group": "T3",
  "workflow_context": "activity_guided",
  "answerability": "answerable_from_corpus",
  "evidence_mode": "frozen",
  "cohort": "synthetic_engineering",
  "stress_set": false,
  "inputs_ref": {
    "path": "../inputs/inv-pa03-estimate-missed-active.json",
    "sha256": "44f7798bc6f8cc2042ea28623a8af2089a61401799d6e1c641d124cde553ed49"
  },
  "gold_ref": {
    "path": "../gold/inv-pa03-estimate-missed-active.json",
    "sha256": "b66765a3d625f4975c277a825c5fa3964d5a67919b1e1035e2236ebec0bbad3b"
  },
  "provenance": {
    "kind": "synthetic_engineering_fixture"
  },
  "dependency_groups": {
    "compounds": [
      "Cc1ccc(Nc2nccc(n2)-c2cccnc2)cc1"
    ],
    "documents": [
      "MED:93131"
    ],
    "measurements": [
      "inv-pa03-estimate-missed-active:estimate",
      "inv-pa03-estimate-missed-active:ic50"
    ],
    "sources": [
      "MED:93131"
    ]
  },
  "split": "dev",
  "spec_sha256": "48e044b28ad96b1a1793e1312b94a95942e82100bfe82d5ceee0ea140a15c05c"
}
